user_id,user_name,review_text,helpful_votes,funny_votes,recommendation,date_posted
benwongxdxd,DAT Noob,To those who got it for free: Download mods instead of buying cashgrab dlcs.,3895,96,1,"19 October, 2022"
zeruel132,Zeruel,HEADS UP FOR POTENTIAL BUYERS - The base game will be FREE TO PLAY from Oct 18th. :),1587,16,1,"14 September, 2022"
plaguedoctorbf,plague doctor bf,"It's fun, but it feels empty without the very overpriced DLC.",1126,92,1,"15 October, 2020"
FOTF,José Juan Álvarez,"$764 ""DLC"" for the full game. Go f͏u͏c͏k͏ yourselves, EA.",6607,793,-1,"10 December, 2020"
76561198829520134,Yoshi,Don't buy DLC download mods instead The base game is free because you have to buy 90% of the rest of the game,1613,30,1,"18 October, 2022"
76561199126332614,Galahad,just wish dlc prices were lower lol,794,32,1,"30 November, 2021"
twirly_369,⚜️Twirly,To those who got it for free: Download mods instead of buying cashgrab dlcs.,624,15,1,"23 May, 2023"
76561198160660673,Cid Raines,Sims 4 is a lot of fun but the exorbitant prices on the DLC are just too much. The DLC really adds a lot to the game so not having it hurts.,1653,21,-1,"13 June, 2021"
76561198931293438,cadaverousss,"The game is pretty cool, but seriously. Cmon EA. You couldn't even give us pets for free? EVERY DLC COSTS AS MUCH AS THE GAME. That's like buying another copy! I just hate how you have to put a price tag on every little thing- [Please pay $60.00 to unlock the rest of this review.]",1816,903,1,"26 December, 2020"
Hugtrain,Hugtrain,"This game is great but ITS WAY TOO EXPENSIVE I mean come on! It's 6 years old! Why does the game cost 40 dollars, and every DLC costs the same? The game doesn't feel complete without owning at least 5 DLC packs, but I don't have 482 dollars to throw away at some game from 2014! It's so hard to decide what to buy because there are so many packs that go together, some that aren't complete without another, and some that just have a couple Itmes I really want but is too expensive",1869,80,1,"4 November, 2020"
76561198815334337,mrgazzer89,Congratulations EA you have unlocked a review! to upgrade this review to positive you can purchase our DLC positive review package to enjoy the complete review! now only for 40$!,1892,1524,-1,"December 24, 2021"
Yastunes,𝐘𝐀𝐒™,"$764 ""DLC"" for the full game. Go f͏u͏c͏k͏ yourselves, EA.",1786,162,-1,"June 25, 2023"
DeuSfps,DeuS,To those who got it for free: Download mods instead of buying cashgrab dlcs.,579,6,1,April 18
Kenendy,Kenendy,"$995 ""DLC"" for the full game. Go f͏u͏c͏k͏ yourselves, EA.",2371,252,-1,"March 7, 2023"
76561198820528795,Happy Unlucky,"It is fun. You can spend hours playing it, but the fact that the DLCs cost as much as the base game is outrageous. If there was a ""meh"" rating, I would give it simply because of that.",1001,79,1,"June 25, 2020"
Ultragamer2004,Ultragamer2004,"The game is good, but the DLCs are very expensive. Just add the base game to your Steam account and use EA's DLC unlocker for free access to each and every DLC.",875,41,1,"December 9, 2022"
aholeindustries,hole,to those who got it for free download mods instead of buying cashgrab dlc,466,17,1,February 11
wisecup26,wisecup,if u bought  every dlc in the sims 4 it would roughly cost 700 dollars. you could either buy a ps5 or every dlc in the sims 4,807,331,1,"June 6, 2021"
Jye_Jye,DΩVID,88% off is a damn good price for what it's offering. I recommend it highly. Only downside is... DLC being worth A$ 608.30 with discounts... EA... are you serious. Edit after almost exactly 3 years; Never imagined to see EA of all companies make this game free. I feel really bad for those who spent full price for this.,874,94,1,"November 30, 2020"
76561199229759681,tjlemke99,"While I love the sims, and this entry certainly runs smoother and looks better, with better character customization, that's where the good things about this game stop. It still costs hundreds of dollars to buy all the DLC for this game, and let me tell you that they've made everything into a DLC. Want a pet? DLC. Want to take your Sims out to a restaurant sometimes during the week like a normal person would do? DLC. Want to pretty much do anything with your Sims besides have them sit at home or wait for them to come back from working a job? DLC. It's after you play for a while and decide you want to start doing things, that  you realize you actually can't do sh** until you buy some DLC. This game has been out for years and there still isn't a bundle with all the DLC. I'm not going to buy a single pack, EA, you damn buffoons. I would have been happy to spend up to like $100 total on this game, but now I will stick with the free version and not spend a dime on the stupidly overpriced DLC. I would rather download all the DLC illegally than pay you hundreds for it. Honestly, I'd recommend you just play Sims 3, because there is a ton of included content compared to this game.",649,18,-1,"November 26, 2023"
lorzo-,𝗟𝗼𝗿𝘇𝗼,the sims 2 outsold,698,83,1,January 2
xikay,󠀡󠀡,10/10 love making myself as a sim and drowning myself whenever i'm depressed from looking at the dlc prices,507,533,1,"October 15, 2020"
milesware,Elonian Musket,"There should be a competing title in this genre so that EA won't keep cashing in on this community which has been more and more lenient and tried its best to put up with whatever bs dlc the devs have put together. It's a shame that this franchise has fallen so far. Pros: -Bunch of really nice quality of life features compared to the previous titles Con: -The game feels soulless and cutting corners at every possible opportunity to do so. -DLC price tag unjustified unlike the previous titles -Terrible and baffling game design decisions everywhere, they're some of the most cored features too -Action queue is extremely buggy years after the game's release, the amount of time for a sim to perform action/idling is nonsensical. -Removed sandbox design and put in the older scene/lot system is such a backwards compromise that's almost certainly done for technical/engine limits reason, such a shame to see so much game design potential being thrown into the trash because they chose the easy way out.(As expected, the decision here came back to bite them when they design some of the dlc content, which feels really disrupted by the constant fast travelling",728,8,-1,"July 7, 2020"
Zanturo,Swan Ronson,"I love The Sims. I love The Sims 4. Here's why I don't recommend it. -Still launches through Origin. Buying on Steam just adds another layer of DRM. -If you previously purchased through Origin, you will need to redownload any DLC, even if you already had it installed -Your DLC carries over, the base game does not, which means you'll have to purchase the base game again. -Your DLC doesn't 'unlock' through Steam's store, if you purchased it on Origin (because of course it doesn't) This is probably the worst Steam integration I've ever seen. Don't buy it here if you already own it, just use ""add non-Steam game to library"". It's almost identical and $20 cheaper.",1320,35,-1,"June 20, 2020"
76561199058242183,🆂🅸🅽🅰🅻🅰🆄,DLC are so expensive and the EA Apps makes it even worst.,1684,44,-1,"June 2, 2022"
76561198413922918,Maxi,"It´s a relly good game, but the prices for the DLCs are simply disgusting as you would expect from EA. 7/10, The Sims series is good, but the DLC prices are outrageous.",336,7,1,"June 12, 2022"
soylentwill,soylentWill,It really should be free on Steam if you own it on Origin.,828,16,1,"November 1, 2020"
bonnnetwork,Bonnnetwork | TTV,I do not regret cracking the DLC's,410,91,1,"September 14, 2023"
76561198168802858,TheTofuKiller,"TLDR: DO NOT BUY BASE SIMS 4!! Buy it HEAVILY DISCOUNTED bundled with one of the major expansions (Seasons or Pets), and MOD THE ♥♥♥♥ OUT OF IT!! Base Sims 4 is nearly unplayable due to the lack of content, repetitive and easily manipulative emotions system, and an overall feeling of restriction. Which is damaging in a game series that is designed around player freedom. There are also so many irritating qualities to it that make it seem like it wasn't fine tweaked enough. Why is every single Sim such a social butterfly that I cannot get them to stop talking to each other for five seconds? Why do they take so long to eat? Why are the lots so small and so empty? Why is nearly nothing from Sims 3, and heck, even Sims 2 brought over?? (Horses, Cars, pools, restaurants, grocery stores, fun recreational activities, ect.) With that being said, there is some classic Sim Fun to be had with this game, if you are able to get it for a heavily discounted price and get it bundled with one of the major expansions (I would recommend either Pets or Seasons). I would also highly recommend downloading a plethora of Mods, because they fix a vast majority of the systems in base Sims 4 that make it more enjoyable. If Mods are not your thing, then I would think twice about purchasing this game. **This is one of the easiest games to Mod fyi** Mod Recommendations (Like seriously, don't even play base Sims 4 before downloading these Mods) Sims 4 Mod Manager by Raxdiam (Not necessary, but a very convenient and easy way to keep track of your mods. Very user friendly, will do 100% of the work for you) Meaningful Stories by roBurky (A mod pack that effectively revamps the mood and emotions systems of Sims 4. This makes the systems feel waaay more fleshed out and realistic, and significantly less manipulatable) Better Romance by simler90 (Adds more rules and checks into how Sims romance one another. In base Sims 4, you are basically always guaranteed to succeed in romance. There is quite literally no way to fail. This Mod expands heavily upon it, making it so that the traits Sims have will impact whether or not they will accept any advances.) Wonderful Whims by TURBODRIVER (Goes great with Better Romance with no compatibility issues that I'm aware of. Adds in an Attractiveness system, first Impressions, Personality Archetypes, and even a Menstrual Cycle and Birth Control system. With this, you are more equipped to design your Sims overall sexuality and sexual lives. Hugely rewarding, and designed perfectly that it will seem like it is a natural part of the game.) There is also a ♥♥♥♥ load of CC (Custom Content) out there like clothes, hair, buildings, Sims, ect. ""Mod The Sims"" is the best place to find all of this. Don't spend money on any of the Stuff Packs, because most of that stuff included in them you'll find for free made by someone online. Usually looks nicer too.",442,6,1,"July 1, 2021"
memesnbeer,MemesNBeer,You have to buy DLC packs that are near the price of the actual game to get content that you would expect to be part of the game to begin with. The vanilla barebones experience is a stale snore feast and I refuse to support scummy EA's garbage business practices with their stupid expansions,1228,30,-1,"January 22, 2021"
euamokpop,l(uwu)izinha♡⸜(˃ ᵕ ˂｡),game = good EA = bad 60 DLCs = cringe,419,72,1,"October 19, 2022"
76561199050658579,Isa,I play The Sims since my early teenage years. Loved every minute played... but The Sims 4 has really overpriced DLCs.  $700 for the whole thing is a joke!,640,38,1,"July 8, 2020"
AllGunny,Gunny,"Had 12 kids with 8 different women, became an astronaut, then died when I tried cooking mac and cheese. 10/10",530,454,1,"October 26, 2023"
gs4ever,★☆ GS4ever ☆★,"Fun game, but $800 for full content is a little bit high, even for EA...",553,32,1,"December 7, 2020"
canadianthanos,thanos,classic $E$A$ making the game boring without paying for the DLCs with each one costing the same as the base game,1679,41,-1,"April 6, 2021"
nosferatupls,Nosferatupls,"Listen, I love the sims, but $1500 for all DLC is violently ridiculous and begs for torrents. Release a finished game or make DLC's few and far between. The endless greed of EA needs to stop.",318,4,-1,July 9
76561199078472322,Halo 3 Rat,My sims are blissfully unaware of the small ugly green man living under their floorboards. His sole purpose is to paint so my main sims don't have to get jobs. God bless the painting goblin,339,213,1,"April 28, 2023"
herr_solaire,Skubba Westwood,"Great game, but the downloadable content is much too expensive for how little it offers. I find myself spending countless hours playing the game, but when I want specific things in my game, that you can only get from the DLC and not mods, it annoys me because I don't want to spend my whole paycheck on a tiny little specific detail that makes a world of difference.",800,4,1,"August 21, 2020"
ouenji,ouenji,"Before this review, I feel like it's important to say that I have more than 23.7 hours in this game. A LOT more. I've got that much alone on PS4, and 500+ hours on my original origin account, which I can sadly no longer access to check the exact number. I got this game 9 years ago, full price retail, and have played it on and off since the age of 9. I've played this game to death over the years, and that's why it hurts me to leave a negative review. You can still have fun with it, and I will explain that, but it's flaws are just too plentiful for me to leave a positive review. It would be easy to say that this game used to be great, but that... would be a blatant lie. The game was barren when it released. Key features from past games were missing, like toddlers and POOLS. How were we supposed to kill our sims now? Give them a long and happy life until a natural death? Hardly! Along with that, the map screens didn't even have colour; they were pure white, sterile places. Maybe it was supposed to be stylistic, but... I can't help but think about how much cheaper it must have been. Slowly, over the years, we started to get more DLC packs of various tiers. It didn't start out too egregious, I wouldn't say. Sure, Luxury Party Stuff was lacklustre, but we had things like Outdoor Retreat to keep us going! Though, it was hard not to note how quickly EA had jumped to make DLC whilst the core game was missing such basic features. That isn't even to say how the community at large took the closed-world and lack of colour and pattern customisation. I'll tell you how they took it; badly. They took it badly. With all this DLC, there was a problem. IT. DIDN'T. STOP. Now, it's normal for a Sims game to have a large amount of DLC. But this? It became staggering. As of this review, all of the DLC for this game will run you over $800. OVER. EIGHT. HUNDRED. DOLLARS. I'll let that sink in. Have you ever wondered how this game is free? That's how. It's not like this DLC is truly optional. Some of it is, sure! But would you like your life simulator to have weather? A normal amount of clothes? More than THREE PLACES TO LIVE, ONE OF THEM BEING AN EMPTY FIELD? Then you'd best pony up! It's hard to fully express how empty this game feels without DLC. And EA knows it feels that empty, and that they can keep milking us for every last cent. At this point, you may have noticed something, or you may have not. And that's the fact that I said I've been playing this game for nine years. And that means the game has been out for nine years now. Since 2014. This game is almost a decade old. This is an issue. A big issue. When this game first released, it prided itself on it's intelligent autonomous sims. They can multitask; like watching television AND eating at the same time! Wowzers! But with this much time having passed, you'd be hard pressed to find somebody confident to call these sims anything above 'serviceable, I guess'. Your sims will wash their plates in the bathroom! Your sims will grab water if you leave them alone for two seconds and drink until they experience bladder failure! Your sims will start a fight with their spouse, seemingly just for kicks! Your sims will stop moving until you reset them with a cheat code! Your sims will be left with an undeletable action in their queue until you, again, use a cheat code! You get the picture. This game is a mess, with problems that could be wiped clean in a theoretical Sims 5. So why don't they? Because EA have created a live-service single-player game, and they'd be stupid to give it up. This live-service model, piling DLC upon DLC onto the game? It's managed to cause even more issues than the game had to begin with. Each new download comes with new bugs unique in nature. Oops, there go your textures! Oops, your sims are now all autonomously screaming at each other! Oops, your Sims are BUILDING ROMANTIC RELATIONSHIPS WITH THEIR OWN CHILDREN! These are the kinds of things you'll have to get used to, and this only gets worse each time they add DLC. There are problems in this game that have become support beams by this point; fix those bugs, and everything will fall apart. So they just... don't! The Sims 4 is fundamentally broken, and they won't throw the game out and start fresh, because the horse they're beating still isn't dead. Just bleeding and shambling. This greed helped lead to the point we've reached today. Even with the uproar against My First Pet Stuff (A DLC for a DLC), it seemed enough people were content to buy such a tiny stuff pack because we got a whole new category for things just like it. Kits. Dear lord, kits. These things aren't popular with the community, and it's clear to see why. Such meagre amounts of items might seem doable at $5 a pop, but they're adding up, and quick. Filled with lacklustre designs that only work well as a base for custom content, they're the peak of EA's lazy contributions to this game. I mentioned custom content, so I suppose that's a horse out the stable now. Yeah, custom content is amazing. And that's because EA has no hand in it. Well, I should give them a little credit; the native mod support is an honestly nice touch! There's your first positive, EA. Custom content is a general term for items created by the community. Clothes, furniture, accessories, you name it! With multiple dedicated sites to download it, and fan made tools that make creation easy, it's great! And by easy, I mean easy. I was making Pokemon shirts for my games at age 12. Just takes a little research. All these items come in two main styles; one more realistic (Alpha) and one to match the game's items (Maxis Match). Build up a good folder filled with gigabytes of fashion and get to work living your life in Create-A-Sim; don't forgot to buy a new SD card to fit it all in. You'll need it. It's not just custom content that the community makes. There's also good old fashioned script mods. These have all sorts of functions; they can fix some in-game issues, add entirely new game mechanics, give you features that you always wanted (controllable pets comes to mind), and more. (More including the... infamous Wicked Whims and Extreme Violence mods. Ah, timeless classics). All these mods help breathe new life into the game and show how passionate this community can be, no matter how downtrodden by the source material. These mods help to show how this game is actually fun at it's core. You might have read all this ragging and be baffled by my heel-turn, but it's true. Why else would I have put in all those hours? That core gameplay loop of letting your sims lead their lives is damn fun, and I can't help but enjoy it; even with everything EA is doing. I think that others could enjoy it too if they started playing today. There is something here, at the heart of it. It's just coated in a decade of bloat and greed. (This segment is a replacement for an old one that caused me issues, that I'm removing to keep this review safe. I think you can tell by the comments below and the tone of this review what that was, and you can take that as you wish.) Anyway, EA can do one, and you should give Sims 4 a chance, if you like. There's good here, but this game reeks of greed and jank at it's core.",416,16,-1,"January 23, 2023"
76561199140347715,CNS95,"My Gf loves and plays this game a lot. but i have noticed The whole DLC packages for the game is total rip off. I understand maybe buying a pass for x of dlc but the fact you have to pay for each one is an actual joke. making them spend £18 plus to be a werewolf, Vampire or to just have a Pet. They even charge for seasons like snow etc. It's EA so makes sense, This game is the literal embodiment of slicing up the game and selling the pieces back to consumers.  Or a 1000 piece jigsaw but charging you after 10 pieces have been put together. They don't even give loyal or franchise veterans anything for free. If you're rich or don't intend on buying loads of DLC maybe buy this game. Fans should take a stand and boycott the franchise to stop their greed until they remove this awful scheme of extracting money from fans. I hope sims fans get an apology but also more of making sure fans actually get the content they pay for when they buy the game.",705,16,-1,"July 10, 2022"
BaseballJones,BaseballJones,"Listen, I love the Sims and have for literally decades but it is absolutely not because it's a great game, it's just the only one out there. The MOMENT - THE. MOMENT. - someone comes along who can make a competing life sim/builder (*cough* lookupParalives) I am ditching this game forever. Sick of EA's greed, I'll never buy another Sims game just out of spite. This game is awkward and clunky with weird bugs like Sims idling forever instead of doing the next thing in their action queue - or household items spontaneously moving or disappearing. A single expansion costs as much as the base game. All expansions total more than a PS5. It's outrageous. And save your ""buy it on sale""s because: No.",1605,47,-1,"January 27, 2022"
Oxified,Oxified,"DLC Costs $1,324.17 YouTube™ Video: T&JM: Money is such a beautiful word Views: 1,740,591 We've got to have... MONEY... Quite so, quite so.",769,102,-1,"April 28, 2022"
heavymetalhurricane,stonetomcat,"When a game's DLC's cost almost $1,000 USD, I simply can't recommend it.",863,48,-1,"November 1, 2022"
ik0la,ikola,for the love of god do not buy the dlcs,705,61,1,"March 14, 2023"
RogueAssassin256,Brady,$850 Of DLC,810,100,-1,"September 11, 2021"
RilfDanielson,Rilf Danielson,You have to pay $10 just to get the laundry pack which includes basic things like...a washing machine. EA is scum.,491,25,-1,January 26
76561198193426228,Keiko,Well... It would be better if the expansions were a little more cheap,344,6,1,"April 6, 2022"
pfeilkopf,PfeilKopf,"It's a pretty good game, I don't know if it's $939.45 good though.",574,177,-1,"August 28, 2022"
76561198803138376,Maximus,"The game is pretty cool, but seriously. Cmon EA. You couldn't even give us pets for free? EVERY DLC COSTS AS MUCH AS THE GAME. That's like buying another copy! I just hate how you have to put a price tag on every little thing- [Please pay $60.00 to unlock the rest of this review.]",490,239,1,July 24
76561198388265422,Thynudybooty,"The base game has about $5 worth of content. Why? Because EA do what EA does, it cost around $2000 cad to get the full game. I wish I was kidding. The DLC cost just that much and they put so little into the base game so in order to enjoy the game you have to buy the DLC. Why do people support this crap? How is this legal? Edit: And now if you've purchased this game on Steam instead of EA's direct website you have issues trying to play. Someone needs to sue EA at this point for their scummy behaviour.",1218,41,-1,"October 30, 2020"
