user_id,user_name,review_text,helpful_votes,funny_votes,recommendation,date_posted
starcrescendo,starcrescendo,"Oh The Sims 4, how I longed to leave a review of this before. But oh what a surprise, you can't leave reviews on the EA/Origin app. I wonder why that is. After what seems like 100 years of them pushing this unfinished and unwanted piece of trash on us, the game is still riddled with bugs, poorly optimized, badly coded, and devoid of basic features. I would not recommend this game on my worst enemy. In Sims 4, there is a severe lack of gameplay and they stripped out half the features of the Sims 3 base game. Which in itself was a great game, lacking only in technical performance aspects and a severely aggressive micro-transaction model, and a few minor gameplay features from the previous Sims games before it. Then we arrive to Sims 4, with no more open world, now you are limited to EAs poor selection of cookie-cutter worlds devoid of life and fun places to go. You can only add a handful of buildings and 4 or 5 houses in an entire city. And then when you go to a location, random people spawn but the game can't handle more than a few, so you end up on large empty lots with nobody around. It makes no sense that a 2011 game of Skyrim which has been released on ever platform imaginable can spawn hundreds of NPCs with routines into a city and they can go about their day but EA can't manage to program a game years later that runs with a simple variable to track how much someone has to go pee pee? It is pure ineptitude and incompetence on the part of EA and their developers, or complete and brazen leadership that has no vision and no concern for the fans or the game genre. Generally, when you buy the base version of a game, and they come out with a sequel, they integrate some or most of the previous game DLC into the new one - not EA. They charge you for every single feature all over again in the form of expansion packs and stuff packs. And half of the expansion packs lack concepts and items that were in that same expansion pack for the previous game. Though EA remains committed to pushing packs out their a**, it's clear they have no intention of fixing the obvious problems in this game, and have not learned a single lesson from the obvious failures of this game to put towards Sims 5 going forward. You may see that my playtime increases in this game and question that against this review. This is because it is simply the only iteration available for this genre for which to scratch a certain gaming itch. The Sims 1 and 2, while great games, and Sims 3 as well, are plagued with issues on modern hardware. Sims 4 is the only version that works to some degree. There are some mods you can install to add some gameplay features, but the game never holds your attention for long. I find myself creating people and buildings and then getting ready to play, playing for a while, and getting bored and not playing for months. Then when I come back, all my work is gone due to game updates or the s*** EA/Origin launcher that I have to redo making all my Sims again, and repeat ad nauseam. On the horizon, are finally a bunch of competitors to this game. I anticipate that just like Cities Skylines killed EA's SimCity, and how Planet Coaster killed EA'S Roller Coaster Tycoon, the same will happen to the Sims with one of these new games that will wipe this off the face of the earth due to EA's lack of attention to fans outcries, and malicious monetization of the franchise, and failure to innovate or provide any care for gamers or respect for the series as a whole. Will Wright would be horribly disappointed to see what has become of his creation under EA.",64,0,-1,"December 3, 2023"
76561198237955560,tasteslikevanilla,"I grew up playing the Sims 2 and I remember playing for hours without ever getting bored. I got the Sims 4 and I'm not gonna lie, without any DLCs or expansion packs this game gets boring very easily. You just feel like there aren't as many things to do, it feels very repetitive. I recieved the University one from my boyfriend and since then I've been playing a lot more often, I just feel like they're all too expensive. All in all a pretty cool casual game, it's just too expensive and without any DLCs it's hard to not get bored. 3.5/5",35,0,1,"February 16, 2021"
76561197982872131,Knave,"This game should be classified a schedule 1 drug. It's addictive, expensive, and destroys your life.",43,62,1,"July 2, 2020"
76561199097720902,apricotprints,"If you can get past the inescapable, whiny begging of EA trying to milk as much money as possible out of this game, you'll find it's a great way to express creativity, kill time, and do stupid ♥♥♥♥ in a simulated world. It's worth it to wait until the game is on a mega sale and then never buy the expansion packs.",48,0,1,"September 8, 2022"
A1Pictures,A-1 Pictures,Got a cat here. Friends passing by can touch her and click Like to pet her once. ＿＿ ／＞　　フ | 　　  l ／` ミ＿xノ /　　　 　 | /　 ヽ　　 ﾉ │　　|　|　| ／￣|　　 |　|　| | (￣ヽ＿ヽ)__) 二つ,609,48,1,"July 12, 2023"
76561199072230938,Sian,My sim set their oven on fire and pissed themselves and then went to go eat their toast 10/10,35,42,1,"August 17, 2021"
76561198889526433,Oaktimer,i drowned a man,34,17,1,"August 4, 2022"
alexbali,alexbali255,"sure is great when a 40$ game has 450+ dollars worth of dlc. thanks ea. Edit: It's now 1,150+ dollars",47,8,-1,"September 9, 2020"
Bogdankyy,DnkY,My own sim is living a better life than mine,26,34,1,"October 7, 2021"
76561199229120262,Ellateen,it gay i like,121,53,1,"February 7, 2022"
PinkLadyJade,Pink Lady Jade,"So far I have over 1010 hours for Sims 4 on Origin. The hour counter started all over when I came to Steam to play and had to re-download the game to Steam (this was the only issue that annoyed me) but I'm sure I'll be up to thousands of hours on Steam too. Add all that to the hours that I have played The Sims 4 or other Sims games in the past since I was 17 and that is a lot of playtime! Off and on, over 20 years of play.  Honestly most people prefer the Sims 3 because of attention to detail and more complicated personalities.. but Sims 4 has it's own charms. Personally my old SIMS favorite was The URBZ (Sims in the City)! Id LOVE to play that game again! It gave you a direct path and set achievements as well as some big personalities. So.... welcome to the SIMS if you are new!  This game is pretty hard to explain. Its what you make of it. The SIMS is like real life, all the things that happen depend on your characters choices. That the base game itself stands alone well and you don't need to get the packs and extensions. If you do get them however, most of them will create a new way to play and sometimes a new town or a new world. So honestly, to me that is kind of like a new game. I enjoy getting the packs, but they do usually cost the price of a new game. There are also smaller packs and add ons that are pretty fun too. Again, the packs aren't needed though. The game is unique and interesting by itself. You will never find another game where the characters come to life like this. Games typically center around a goal that your character must accomplish. The environment, people around them and the reactions of your character are written out already and pre-planned. You are watching the game play out the way that it will play out for millions of other players. The SIMS however never plays out the same way. Even when players try the same Sims challenges the turn out will be different and the interplay and things that happen will be random and totally different. The SIMS characters have minds of their own (like AI), their own feelings and their own changeable and achievable dreams. * * *That is what I love the most about the SIMS* * *. The psychology and realism of play when it comes to personalities, emotions, psychology, relationships and life events is wonderful. It is the whole reason I play. Avatars and characters in other games just do not have the random emotions or random decisions like the characters in the Sims. Each time you open the game there are so many random things that can happen. Your own SIM character will have its own mind and so will every SIM in the game that interacts with your Sim. The interplay between characters is what gets interesting. Just be sure to learn to take care of their needs and balance fun with work and life with dreams and their life should end up entertaining (and funny). As your character ages they will change and grow and develop skills, traits, abilities, favorites and more.... they will most likely have spouses, children and even grand-children and each of them will be different as well. Your SIMS can have pets too (and new to the game are farms!). And once they retire and age and eventually die you can switch your mindset to guiding the lives of their kids and grand-kids... it all goes on forever. The life of your sim is a little world of its own with no specified goal just like real life. You are not made to do anything but exist, eat, sleep, wash, go to the bathroom, and have a bit of fun. Everything else about their life or goals or destiny is just dreamt up by the player. Your character can dream of any kind of life and each kind of life is a new game in itself. One SIM could want to be homeless and living in a tent from town to town, another could become the most famous actor ever. Your character can be a hardworking you-tuber or a scientist who gets abducted by aliens. Be a detective and solve crimes or be a veterinarian. You can now even be a Jedi or work for the empire. You can have a cottage with a little farm or be an interior designer. You can work with the paranormal and catch ghosts or just raise a family. There is so much open to you that you are creating your own game. You can also farm in your garden, make money from knitting or just be a mommy with tons of babies. You can own a dog, cat or even animals like leopards. The CC (custom content) that players create is all downloadable for free on safe websites and is also accepted and encouraged for use in the game so that opens up hundreds of opportunities as well. If you are creative at all you wont be able to stop dreaming in this game. There is always something new to do. The cannon characters are great as well. Each character from the game creator will be complicated, different from any others and surprising. All the characters are lgbtq friendly as well. THE SIMS had lgbtq characters back before anyone else. You can add to your cannon SIMS town by making your own new neighbors for your town and replacing all the original neighbors with characters you custom make, or you can stick with the old favorites.  My favorite cannon family is the Goth family (who since the first game were the Adams family of the Sims). Sure their house in SIMS 4 isnt as spooky as it becomes later in their cannon story (sims 1 and sims 2 are later in the timeline), but you can make it as spooky as you like once you play since you can edit all the land, houses and characters in town. Bella Goth is my favorite SIM and has always been kinda why I play.. great personality, spoOOoky oOOoooky family. Enjoy this game. Make it whatever you want. Also... if you become a fan and start wanting to play the older games you will never be disappointed. Each SIMS game is packed with so much to make it unique from the others. Sims 3 still stands up to SIMS 4 and still competes with it in many ways. If you try it you'll see why. Anyway, I hope this helps someone! (Oh did I mention that every word in their language is really translatable? ""Dag Dag!"") PS never play the phone Sims. Its nothing at all like the actual game. Play here, play the full game with the crazy personalities everywhere....the phone games are okay but they dont have the same AI type SIMS, the Sims on phone games have very little personality. So to everyone the SIMS are worth a try, but you've got to know what the game is about first.. be creative and open your mind. You'll also need the cheat codes (allowed by the creators and encouraged), maybe a little of the mods (also encouraged) a few packs for spicing it up.. and an idea of what you want to create. So look it up on you-tube or watch streamers on Twitch so that you know how to go about making a really fun game for yourself!",73,2,1,"April 6, 2021"
pixelatedpigeon,pidge,wicked whims should be base game >//<,111,82,1,"December 14, 2023"
blakeylake,blakeylake,"its the sims, what can i say, they get better and better, need a mortgage for all the expansions though lol",90,70,1,"October 17, 2020"
aloanoon,aloan,"If you're looking for a review on this game you've come to the wrong place, but if you're looking for an outstanding pie recipe you've come to the right place. Ingredients: 6 tablespoons unsalted butter 1/2 cup white sugar 1/2 cup brown sugar 1/4 cup water 1/4 teaspoon cinnamon 1 pinch salt 5 apples - peeled, cored and sliced 1 pastry for double-crust pie Directions: Preheat oven to 425 degrees F (220 degrees C). Combine butter, white sugar, brown sugar, water, cinnamon, and salt in a saucepan over medium heat. Bring to a boil, remove from heat and set aside. Roll out half the pastry to fit a 9-inch pie plate. Place bottom crust in pie plate; pour in apple slices. Roll out top crust into a 10-inch circle. Cut into 8 (1-inch) wide strips with a sharp paring knife or pastry wheel. Weave the pastry strips, one at a time, into a lattice pattern. Fold the ends of the lattice strips under the edge of the bottom crust and crimp to seal. Pour butter-sugar mixture over top of pie, coating the lattice, and allowing any remaining sauce to drizzle through the crust. Bake in the preheated oven for 15 minutes. Reduce heat to 350 degrees F (175 degrees C), and bake until the crust is golden brown, the caramel on the top crust is set, and the apple filling is bubbling, 35 to 40 more minutes. Allow to cool completely before slicing.",191,78,1,"April 12, 2023"
76561199072639225,TheYoNoid,With the cost of DLC I can buy a PS5 and an actual good game instead,46,9,-1,"May 24, 2023"
whyterose7,Whyterose,"I enjoy the game, but it has no long term goals that make me want to keep playing it unfortunately.  I enjoyed Sims 3 much more and play that more often.",38,0,1,"September 9, 2020"
0w0fox,OwOfox,im pissed that its free now i paid 40 dollars for it,121,65,-1,"January 28, 2023"
CW0905,CW0905,"I get to ruin peoples lives, how fun",40,27,1,"May 6, 2023"
100Lives,Celusid,"Oh, it's free to play, that will definitely make us all ignore the $700 of dlc that it has.",62,2,-1,"October 19, 2022"
ravioliocelot,mantı 3 reload 🥟,"they finally managed to add crawling toddlers after like 8 years, yay",31,8,-1,"October 19, 2022"
MistakenChimp79,MistakenChimp79,"I will leave the cat here, so that everybody who passes by can pet it and give it a thumbs up. ／＞　　フ | 　_　 _ l ／` ミ＿xノ /　　　 　 | /　 ヽ　　 ﾉ │　　|　|　| ／￣|　　 |　|　| | (￣ヽ＿_ヽ_)__) ＼二つ",323,23,1,April 18
thirdender,thirdender,"Third party launcher has broken the game. It is very difficult to get the game to launch consistently now, especially since I bought it for my 10 year old daughter. I shouldn't have to teach her to start the EA app, log into my EA account with MFA codes sent to my email, and *then* her game will start. Completely broken launch experience, first on Origin and now on EA App. Will definitely factor against decisions to purchase EA games in the future.",34,0,-1,"August 3, 2023"
76561198179812182,NoNameAvailable,"I love this game but the price on here is just not worth it, half the time it's -FREE- on Origin or selling for $5, unlike the $40 cost on Steam! BTW Origin won't allow you to take the game to Steam only Steam to Origin. To top the cake you gotta pay around $700 for all the dlc. SIMS 3 HAD MORE CONTENT IN THE BASE GAME THEN THIS GAME COULD EVERY WISH FOR, sadly, EA IS JUST MILKING PEOPLE WITH SIMS 4. Overall the only thing I like about the game is the clean looking graphics and small things they have only recently fixed... like stairs but, not worth the cash~money and extra spending just to have DLCs I've got with sims 3 for a better price. PS most dlc barely has anything, mod creators offer more if you really want to get the game. -WARNING- Do research on the dlcs if you purchase!                                                   I only bought this on Steam to have a easier time opening my game since I deleted Origin a while back but, found out I had to download their launcher to play. Love Sims but, frustrated on how EA operates. Good luck uwu~",34,0,1,"July 18, 2020"
Lazingmyshitrn,OfficiallyLazlo,Product received for free pirate the dlcs pirate the dlcs pirate the dlcs pirate the dlcs pirate the dlcs pirate the dlcs pirate the dlcs pirate the dlcs pirate the dlcs pirate the dlcs pirate the dlcs pirate the dlcs pirate the dlcs pirate the dlcs pirate the dlcs pirate the dlcs pirate the dlcs pirate the dlcs pirate the dlcs pirate the dlcs pirate the dlcs pirate the dlcs pirate the dlcs pirate the dlcs pirate the dlcs pirate the dlcs pirate the dlcs pirate the dlcs pirate the dlcs pirate the dlcs pirate the dlcs pirate the dlcs pirate the dlcs pirate the dlcs pirate the dlcs pirate the dlcs pirate the dlcs pirate the dlcs pirate the dlcs pirate the dlcs pirate the dlcs pirate the dlcs pirate the dlcs pirate the dlcs pirate the dlcs pirate the dlcs pirate the dlcs pirate the dlcs pirate the dlcs pirate the dlcs pirate the dlcs pirate the dlcs pirate the dlcs pirate the dlcs pirate the dlcs pirate the dlcs pirate the dlcs pirate the dlcs pirate the dlcs pirate the dlcs pirate the dlcs pirate the dlcs pirate the dlcs pirate the dlcs pirate the dlcs pirate the dlcs pirate the dlcs pirate the dlcs pirate the dlcs pirate the dlcs pirate the dlcs pirate the dlcs pirate the dlcs pirate the dlcs pirate the dlcs pirate the dlcs pirate the dlcs pirate the dlcs pirate the dlcs pirate the dlcs pirate the dlcs pirate the dlcs pirate the dlcs pirate the dlcs pirate the dlcs pirate the dlcs pirate the dlcs pirate the dlcs pirate the dlcs pirate the dlcs pirate the dlcs pirate the dlcs pirate the dlcs pirate the dlcs pirate the dlcs pirate the dlcs pirate the dlcs pirate the dlcs pirate the dlcs pirate the dlcs pirate the dlcs pirate the dlcs pirate the dlcs pirate the dlcs pirate the dlcs pirate the dlcs pirate the dlcs pirate the dlcs pirate the dlcs pirate the dlcs pirate the dlcs pirate the dlcs pirate the dlcs pirate the dlcs pirate the dlcs pirate the dlcs pirate the dlcs pirate the dlcs pirate the dlcs pirate the dlcs pirate the dlcs pirate the dlcs pirate the dlcs pirate the dlcs pirate the dlcs pirate the dlcs pirate the dlcs pirate the dlcs pirate the dlcs pirate the dlcs pirate the dlcs pirate the dlcs pirate the dlcs pirate the dlcs pirate the dlcs pirate the dlcs pirate the dlcs pirate the dlcs pirate the dlcs pirate the dlcs pirate the dlcs pirate the dlcs pirate the dlcs pirate the dlcs pirate the dlcs pirate the dlcs pirate the dlcs pirate the dlcs pirate the dlcs pirate the dlcs pirate the dlcs pirate the dlcs pirate the dlcs pirate the dlcs pirate the dlcs pirate the dlcs pirate the dlcs pirate the dlcs pirate the dlcs pirate the dlcs pirate the dlcs pirate the dlcs pirate the dlcs pirate the dlcs pirate the dlcs pirate the dlcs pirate the dlcs pirate the dlcs pirate the dlcs pirate the dlcs pirate the dlcs pirate the dlcs pirate the dlcs pirate the dlcs pirate the dlcs pirate the dlcs pirate the dlcs pirate the dlcs pirate the dlcs pirate the dlcs pirate the dlcs pirate the dlcs pirate the dlcs pirate the dlcs pirate the dlcs pirate the dlcs pirate the dlcs pirate the dlcs pirate the dlcs pirate the dlcs pirate the dlcs pirate the dlcs pirate the dlcs pirate the dlcs pirate the dlcs pirate the dlcs pirate the dlcs pirate the dlcs pirate the dlcs pirate the dlcs pirate the dlcs pirate the dlcs pirate the dlcs pirate the dlcs pirate the dlcs pirate the dlcs pirate the dlcs pirate the dlcs pirate the dlcs pirate the dlcs pirate the dlcs pirate the dlcs pirate the dlcs pirate the dlcs pirate the dlcs pirate the dlcs pirate the dlcs pirate the dlcs pirate the dlcs pirate the dlcs pirate the dlcs pirate the dlcs pirate the dlcs pirate the dlcs pirate the dlcs pirate the dlcs pirate the dlcs pirate the dlcs pirate the dlcs pirate the dlcs pirate the dlcs pirate the dlcs pirate the dlcs pirate the dlcs pirate the dlcs pirate the dlcs pirate the dlcs pirate the dlcs pirate the dlcs pirate the dlcs pirate the dlcs pirate the dlcs pirate the dlcs pirate the dlcs pirate the dlcs pirate the dlcs pirate the dlcs pirate the dlcs pirate the dlcs pirate the dlcs pirate the dlcs pirate the dlcs pirate the dlcs pirate the dlcs pirate the dlcs pirate the dlcs pirate the dlcs pirate the dlcs pirate the dlcs pirate the dlcs pirate the dlcs pirate the dlcs pirate the dlcs pirate the dlcs pirate the dlcs pirate the dlcs pirate the dlcs pirate the dlcs pirate the dlcs pirate the dlcs pirate the dlcs pirate the dlcs pirate the dlcs pirate the dlcs pirate the dlcs pirate the dlcs pirate the dlcs pirate the dlcs pirate the dlcs pirate the dlcs pirate the dlcs pirate the dlcs pirate the dlcs pirate the dlcs pirate the dlcs pirate the dlcs pirate the dlcs pirate the dlcs pirate the dlcs pirate the dlcs pirate the dlcs pirate the dlcs pirate the dlcs pirate the dlcs pirate the dlcs pirate the dlcs pirate the dlcs pirate the dlcs pirate the dlcs pirate the dlcs pirate the dlcs pirate the dlcs pirate the dlcs pirate the dlcs pirate the dlcs pirate the dlcs pirate the dlcs pirate the dlcs pirate the dlcs pirate the dlcs pirate the dlcs pirate the dlcs pirate the dlcs pirate the dlcs pirate the dlcs pirate the dlcs pirate the dlcs pirate the dlcs pirate the dlcs pirate the dlcs pirate the dlcs pirate the dlcs pirate the dlcs pirate the dlcs pirate the dlcs pirate the dlcs pirate the dlcs pirate the dlcs pirate the dlcs pirate the dlcs pirate the dlcs pirate the dlcs pirate the dlcs pirate the dlcs pirate the dlcs pirate the dlcs pirate the dlcs pirate the dlcs pirate the dlcs pirate the dlcs pirate the dlcs pirate the dlcs pirate the dlcs pirate the dlcs pirate the dlcs pirate the dlcs pirate the dlcs pirate the dlcs pirate the dlcs pirate the dlcs pirate the dlcs pirate the dlcs pirate the dlcs pirate the dlcs pirate the dlcs pirate the dlcs pirate the dlcs pirate the dlcs pirate the dlcs pirate the dlcs pirate the dlcs pirate the dlcs pirate the dlcs pirate the dlcs pirate the dlcs pirate the dlcs pirate the dlcs pirate the dlcs pirate the dlcs pirate the dlcs pirate the dlcs pirate the dlcs pirate the dlcs pirate the dlcs pirate the dlcs pirate the dlcs pirate the dlcs pirate the dlcs pirate the dlcs pirate the dlcs pirate the dlcs pirate the dlcs pirate the dlcs pirate the dlcs pirate the dlcs pirate the dlcs pirate the dlcs pirate the dlcs pirate the dlcs pirate the dlcs pirate the dlcs pirate the dlcs pirate the dlcs pirate the dlcs pirate the dlcs pirate the dlcs pirate the dlcs pirate the dlcs pirate the dlcs pirate the dlcs pirate the dlcs pirate the dlcs pirate the dlcs pirate the dlcs pirate the dlcs pirate the dlcs pirate the dlcs pirate the dlcs pirate the dlcs pirate the dlcs pirate the dlcs pirate the dlcs pirate the dlcs pirate the dlcs pirate the dlcs pirate the dlcs pirate the dlcs pirate the dlcs pirate the dlcs pirate the dlcs pirate the dlcs pirate the dlcs pirate the dlcs pirate the dlcs pirate the dlcs pirate the dlcs pirate the dlcs pirate the dlcs pirate the dlcs pirate the dlcs pirate the dlcs pirate the dlcs pirate the dlcs pirate the dlcs pirate the dlcs pirate the dlcs pirate the dlcs pirate the dlcs pirate the dlcs pirate the dlcs pirate the dlcs pirate the dlcs pirate the dlcs pirate the dlcs pirate the dlcs pirate the dlcs pirate the dlcs pirate the dlcs pirate the dlcs pirate the dlcs pirate the dlcs pirate the dlcs pirate the dlcs pirate the dlcs pirate the dlcs pirate the dlcs pirate the dlcs pirate the dlcs pirate the dlcs pirate the dlcs pirate the dlcs pirate the dlcs pirate the dlcs pirate the dlcs pirate the dlcs pirate the dlcs pirate the dlcs pirate the dlcs pirate the dlcs pirate the dlcs pirate the dlcs pirate the dlcs pirate the dlcs pirate the dlcs pirate the dlcs pirate the dlcs pirate the dlcs pirate the dlcs pirate the dlcs pirate the dlcs pirate the dlcs pirate the dlcs pirate the dlcs pirate the dlcs pirate the dlcs pirate the dlcs pirate the dlcs pirate the dlcs pirate the dlcs pirate the dlcs pirate the dlcs pirate the dlcs pirate the dlcs pirate the dlcs pirate the dlcs pirate the dlcs pirate the dlcs pirate the dlcs pirate the dlcs pirate the dlcs,28,6,-1,January 21
