user_id,user_name,review_text,helpful_votes,funny_votes,recommendation,date_posted
76561198036134872,JT,"DO NOT BUY THIS FROM STEAM! I bought this and several DLCs at the same time. It won't run and they force you to get an Origin account anyway. I tried for hours to get it to work - multiple reinstalls, downloads, and forum fixes. Nothing. All I see is a black screen with a spinning blue ring. Steam refers you to Origin that refers you to EA games. All of them refer you to forums and don't actually provide any assistance. It is a never ending circle. Steam did not even read my refund request immediately denied it saying I played 4 hours. The 4 hours they ""claim"" I was playing was actually 4 of the MANY I tried to fix it and make it load. They refused a refund on almost $300  -  still doesn't work and you have no way of contacting them. Currently filing a dispute with my credit card company. NO response from STEAM or customer support. It is unacceptable. I have had Steam for years and played Sims when I was younger. NEVER have I had this much trouble and certainly did not expect NO help. Don't waste your money.",3,0,-1,"August 6, 2020"
cubyyy10,cuby,woohoo all day everyday,3,0,1,"October 22, 2022"
76561198977700812,Артём,this game sucks,3,0,-1,"October 20, 2022"
76561199015933401,vk1,"The problem with this game is that it is controlled by Origin. It does not open, you have to redownload it every time. You should be able to play it through steam but you cant.",4,0,-1,"January 11, 2021"
RoyX1v,RoyX1v,⠄⠄⣿⣿⣿⣿⠘⡿⢛⣿⣿⣿⣿⣿⣧⢻⣿⣿⠃⠸⣿⣿⣿⠄⠄⠄⠄⠄ ⠄⠄⣿⣿⣿⣿⢀⠼⣛⣛⣭⢭⣟⣛⣛⣛⠿⠿⢆⡠⢿⣿⣿⠄⠄⠄⠄⠄ ⠄⠄⠸⣿⣿⢣⢶⣟⣿⣖⣿⣷⣻⣮⡿⣽⣿⣻⣖⣶⣤⣭⡉⠄⠄⠄⠄⠄ ⠄⠄⠄⢹⠣⣛⣣⣭⣭⣭⣁⡛⠻⢽⣿⣿⣿⣿⢻⣿⣿⣿⣽⡧⡄⠄⠄⠄ ⠄⠄⠄⠄⣼⣿⣿⣿⣿⣿⣿⣿⣿⣶⣌⡛⢿⣽⢘⣿⣷⣿⡻⠏⣛⣀⠄⠄ ⠄⠄⠄⣼⣿⣿⣿⣿⣿⣿⣿⣿⣿⣿⣿⣿⣦⠙⡅⣿⠚⣡⣴⣿⣿⣿⡆⠄ ⠄⠄⣰⣿⣿⣿⣿⣿⣿⣿⣿⣿⣿⣿⣿⣿⣿⣷⠄⣱⣾⣿⣿⣿⣿⣿⣿⠄ ⠄⢀⣿⣿⣿⣿⣿⣿⣿⣿⣿⣿⣿⣿⣿⣿⣿⣿⢸⣿⣿⣿⣿⣿⣿⣿⣿⠄ ⠄⣸⣿⣿⣿⣿⣿⣿⣿⣿⣿⣿⣿⣿⣿⣿⡿⠣⣿⣿⣿⣿⣿⣿⣿⣿⣿⠄ ⠄⣿⣿⣿⣿⣿⣿⣿⣿⣿⣿⣿⣿⣿⠿⠛⠑⣿⣮⣝⣛⠿⠿⣿⣿⣿⣿⠄ ⢠⣿⣿⣿⣿⣿⣿⣿⣿⣿⣿⣿⣶⠄⠄⠄⠄⣿⣿⣿⣿⣿⣿⣿⣿⣿⡟⠄,9,3,1,"October 19, 2022"
76561198143774099,Cigarette,"The game is fun, but the DLC? The DLC's prices are astronomically ABOVE unecceptable. You're paying, at times, MORE THAN HALF of AAA games just to have a tiny feature added.",8,0,-1,"February 19, 2022"
76561198163067480,AriUmiki,As much as i like sims games WHY IS EVERYTHING FOR IT SO EXPENSIVE JEEZ EA I KNEW YOU WERE A CRAPTASTIC COMPANY DIDNT THINK YOU WERE GREEDY PIGHEADED MORONS AS WELL,6,0,-1,"December 8, 2022"
76561198955923928,Tillynugget,bullcrap i paid 20 or smthn pound for this only for it to be turned free this is ridiculous,4,0,-1,"October 22, 2022"
76561199081048870,rAtsrh0t,this game is one of my fav. you should def try it,6,0,1,"September 13, 2021"
76561198985618811,potato_chip,Great game with lots of room for creativity. Some game packs are a little pricy for what you get but they often go on sale so it's best to get them then,3,0,1,January 4
76561199149015284,Dollface,I get to create and control a whole community. If that aint power idk what is.,5,0,1,"July 5, 2021"
76561198422615174,isabelswarbrick,Just let the game die EA,6,0,-1,March 17
KaariN,AsteraFlora,"The entire game would cost close to $870 to play. Even if every single DLC, mod pack, and kit is half off, that's still an arm and a leg to play a SIMULATOR game. I've easily spent over 100 hours on this game and have already spent over $60 just to have pets, plants, and livestock. The base game doesn't even have diving boards for goodness sake. This is an unfortunately very addicting game. It is bright, fun, and relaxing, but this game is extremely financially predatory. I cannot stress this enough: STAY AWAY! Do NOT fall pray! Do NOT encourage having to buy so many pieces of a game!",5,0,-1,"December 26, 2022"
MadLad1667,Mad Lad,"YouTube™ Video: Paramore: Playing God [OFFICIAL VIDEO] Views: 84,529,205 Paramore's music video for 'Playing God' from the album, brand new eyes - available now on Fueled By Ramen at http://smarturl.it/paramore-bne Go behind the scenes of this video at...",8,4,1,"August 1, 2021"
76561197969708233,storm,"It's ok. Some hours of fun. However, lots of broken things and unpolished. The DLC scheme is horrible. A half-game, if you want the full game you need to to buy all those DLCs that should be part of the base game. Plus they force you to install Origin, popularly known for stealing your local computer data: https://en.wikipedia.org/wiki/Origin_(service)#Criticism_and_controversy",4,0,-1,"November 3, 2020"
kc_denton,Evil Kevin C.,completing the tutorial is hard - must complete all aspirations,6,0,1,"October 30, 2020"
76561198020825542,DeadHeadGDF,why did i just pay for this if its free to play wtf,3,3,1,"October 19, 2022"
76561199028646611,Crackermouse8,A decent game published by a scummy company who releases updates as DLC.,4,0,-1,"October 19, 2022"
LemaNeed,Lema,"Gameplay experience The controls are very easy to use, with decent hotkeys and navigation. The game isn’t difficult at all, so I would say it’s very well balanced. Sims 4 does keep me moderately interested in the game and isn’t very excited when you play for the long run. In-game choices does not feel that meaningful, where I feel whatever decision you do, basically doesn’t have consequences or either good or bad rewards. However you play, you still could acquire the same skills, or even apply for the same job regardless of what you do. I can’t say that doing progress or milestones in the game gives players any rewards. So, I feel unsatisfied regarding this. I.e., making your way through life in the game doesn’t bring that much joy. I don’t feel like aging up in-game gives me satisfaction. Presentation & Immersion The game itself doesn’t quite have a story, so you basically have to create one of your own. Even by doing so, it doesn’t feel that much interesting because it doesn’t really matter. For time to time, you often feel very immersive into the game. If you follow and play with a few sims at a time, you feel immersed into their life and actions. Sims 4 is design very well. The visual art and style of the game is very appealing, but not much have changed since the previous game Sims 3. The same goes for the sound and music, this is also very engaging, but still a lot like its previous title. The HUD is very user-friendly and easy to use. Design & Technical Aspects I wouldn’t say that the game is design more than average mechanical wise. Because sometimes the game feels just more less natural and unrealistic. Sims 4 does have a lot of content, but many of these looks weird in my opinion, and there is lack of content in different areas in the game. I.e., the curtains just to mention. There are even lots of different DLC’s with even more content, which is also very expensive. The AI in this game is poor in my opinion. You cannot rely on the “autonomy” function in the game settings. Sometimes a lot of actions just feel unnatural and sometimes I just feel the AI’s just do whatever stupid things they want to do without the influence of household members. “Why would the mother read a book and turn on the music while the baby is asleep?” These kinds of stuff happen all the time and is very annoying. Game settings does give certain ways of adjusting the game and graphics. Still, I feel there are some settings missing from the previous titles. I.e., the level of autonomy. Here you could choose between “off” or “full”. And I do remember there were different options in Sims 3. Since release I’ve been experiencing technical issues and glitches. I.e., for a year ago, there was an insult bug which made people insult each other all the time. The bug existed for a long time and made interactions with other sims impossible. It obviously made me quit for a certain time. The most recent bugs I’ve encountered is tings like “get leftovers”. Sims gets a new plate out of the fridge again and again without eating them. Causing plates with food being placed around every space of the kitchen etc. If you get a newborn, be prepared to have issues interacting with them. Because I’ve had A LOT. Many tasks in “the queue” got stuck and couldn’t be cancelled. Which made me must restart and quit the game several times. While the baby cries og floats in the air just by itself. You can’t do nothing because it would not make you interact. Every day in a sim’s world, this happens. You can’t go one day without experiencing small to moderate bugs. Final Considerations I’m not satisfied with the game. The bugs, content, and game overall just fell more less real and stiffer than its previous title. You can’t even own a car, you can’t even see the town you live in properly, career options are more less available than ever. The experience feels more limited than it should be. A game like this could bring out so much more. And for a game to be 7 years old, I find it hard to be that many bugs and issues which seems too basic to even exist. The replay value is low, because if feels very monotonous and repetitive with every household you play. It’s kind of straightforward going from A to B. Even though it issues, I still feel the game gives a good value for its price because of it being free to play. If you’re looking for a game to play by growing a household with an expecation to play in the long run, I would recommend you not play this game. Summary Gameplay Experience: 17 / 25 Presentation & Immersion: 20 / 25 Design & Technical Aspects: 15 / 25 Final Considerations: 12 / 25 Poor: 64 / 100 Performance or gameplay falls significantly below the passing mark. Requires substantial improvements and may have critical flaws or issues, Not Recommended.",3,0,-1,June 20
76561199119159191,ShanL,Expensive for all the DLC's but fun :D,3,0,1,"September 7, 2021"
reedeht,♡Reedeht リーデート,I use this game to train an AI and watch it do dumb things... other than that it's OK I guess,4,0,1,"September 17, 2020"
coccaa2,Coccaa,"sims 4 is a fun and chill game, however this is the worst DLC implementation I have ever seen ever. The game itself is $40 but goes on sale often for as cheap as $5, but if you want to get every DLC, it will cost you almost $1,000 USD. That is the most unreal and hyperbolic price point I have ever seen in video gaming and it really plays into the EA ""lock everything in the game behind a paywall"" stereotype, which is starting to become a reality... The big content packs that cost $40 aren't even worth it by themselves most of the time. Good game, get on sale, honestly unless EA magically releases some huge bundle on sale with every major content pack for this game, I say don't even bother with the DLC edit 11/1/22: Game is free now so you dont have to worry about the price but still 80% of the content for the game is locked behind paywalls, the base game is depressing compared to the EP packs",3,0,1,"January 11, 2022"
lecadre,Lecadre,"The Sims 4 is the most expansive title of the Sims franchise which has been the original sandbox product and became one of the most popular titles of all time as well as a leader of the industry, from the nostalgic atmosphere of the classic titles all the way to the modern ones it has been an essential part of the industry as it has the foundations of everything else. It provides the experience of creating your own household, characters and story, situated from regular rural and urban environments, while expanded with many other elements including supernatural concepts such as vampires, werewolves, ghosts alongside other things. It allows to form ones relationships, have their professions, customize the house and direct the whole way of life, throughout all of the other additional material and concepts that allude to other media and enchance the overall experience into a neverending adventure.",3,0,1,August 25
SadudeeY,sadudee,she just like me fr,3,0,1,April 21
roopbunny,Bunny,---{ Graphics }--- ☐ You forget what reality is ☐ Beautiful ☑ Good ☐ Decent ☐ Bad ☐ Don‘t look too long at it ☐ MS-DOS ---{ Gameplay }--- ☑ Very good ☐ Good ☐ It's just gameplay ☐ Mehh ☐ Watch paint dry instead ☐ Just don't ---{ Audio }--- ☐ Eargasm ☐ Very good ☐ Good ☑ Not too bad ☐ Bad ☐ I'm now deaf ---{ Audience }--- ☐ Kids ☑ Teens ☑ Adults ☑ Grandma ---{ PC Requirements }--- ☐ Check if you can run paint ☐ Potato ☑ Decent ☐ Fast ☐ Rich boi ☐ Ask NASA if they have a spare computer ---{ Difficulty }--- ☐ Just press 'W' ☐ Easy ☑ Easy to learn / Hard to master ☐ Significant brain usage ☐ Difficult ☐ Dark Souls ---{ Grind }--- ☐ Nothing to grind ☐ Only if u care about leaderboards/ranks ☐ Isn't necessary to progress ☑Average grind level ☐ Too much grind ☐ You'll need a second live for grinding ---{ Story }--- ☐ No Story ☐ Some lore ☐ Average ☐ Good ☐ Lovely ☑ It'll replace your life ---{ Game Time }--- ☐ Long enough for a cup of coffee ☐ Short ☐ Average ☐ Long ☑ To infinity and beyond ---{ Price }--- ☐ It's free! ☑ Worth the price (the game itself) ☑ If it's on sale (the expansion packs) ☐ If u have some spare money left ☐ Not recommended ☐ You could also just burn your money ---{ Bugs }--- ☐ Never heard of ☑ Minor bugs ☐ Can get annoying ☐ ARK: Survival Evolved ☐ The game itself is a big terrarium for bugs ---{ ? / 10 }--- ☐ 1 ☐ 2 ☐ 3 ☐ 4 ☐ 5 ☐ 6 ☑ 7 ☐ 8 ☐ 9 ☐ 10 Overall really fun game but the content is majorly lacking. To get a better experience you need the expansion packs but they are not worth the price (some are the same price as the game originally or even more!). If I had the money to buy all of the expansion packs then MAYBE I could rate the game higher. It's just a big money grab.,5,0,1,"August 21, 2021"
rockkoch,Rockk,wtf jerma house game?!,3,0,1,"October 12, 2021"
WICKED_MANTICORE,WICKED MANTICORE,Can i have my money back now?,3,0,-1,"August 2, 2022"
76561199232390618,bsevorg2010,Game won't even start anymore,6,0,-1,"February 13, 2023"
76561198158231173,𒉭 Kisses4Grandpa 𒉭,"great game, bought it twice, the only reason im thumbing down is bc of the dlc price. they must think were all children of arab oilfield billionaires",9,3,-1,"September 13, 2020"
76561198018050720,JJR_ice princess,Game is really slow and not worth the money you pay for it!,4,0,-1,"July 8, 2020"
Asian_G,A,i bought it 20usd and its free now GG,4,0,-1,June 18
sgtwasteface,WASTEFACE,i am bi,3,0,1,"June 3, 2021"
m3jk,mejku,"Don't know how they managed to do that, but Sims 4 is even worse than Sims 3. Also ""free"" does mean nothing, as base game is empty and you need to BUY a lot of DLCs to fill that gap.",4,0,-1,"October 24, 2022"
76561198248194146,BloodMoonQueen,"This game is really boring and borderline unplayable as the base game. Even if you decide to invest the 1,000+ dollars into all of the dlcs or a bunch of money into the overpriced expansion packs.. Some of them don't even work properly or as intended. This game is fun if you make it fun, you'll probably have to mod it and a bunch of other headaches. I love this game but not as how it is without mods. I'd recommend the sims 2 or 3 if anyone cares about gameplay over graphics because this game is soulless compared to its older versions. :/",6,0,-1,September 4
DevilReviewer,TheDevil'sAdvocate,"no. Just no. I'm not going to support a game which has the vanilla experience being completely empty and boring, only to then have over $1,000 worth of DLC. Even though this game is free, that was not always the case, and Sims4 released at $60.00 with this same DLC issue. no. Just no.",3,0,-1,"September 7, 2023"
velotae,velotae,---{Graphics}--- ☐ You forget what reality is ☐ Beautiful ☐ Good ☑ Decent ☐ Bad ☐ Don‘t look too long at it ☐ Paint.exe ---[Story]--- ☐ It doesn't have ☐ Bad ☐ Average ☐ Good ☐ Fantastic ☑ Make your own story ☐ Its multiplayer what did you expect ---{Gameplay}--- ☐ Very good ☑ Good ☐ It‘s just gameplay ☐ Mehh ☐ Starring at walls is better ☐ Just don‘t ---{Audio}--- ☐ Very good ☑ Good ☐ Not too bad ☐ Bad ☐ Earrape ---{Audience}--- ☐ Kids ☐ Teens ☐ Adults ☑ Humans ---{PC Requirements}--- ☐ Check if you can run paint ☑ Potato ☐ Decent ☐ Fast ☐ Rich boiiiiii ☐ Ask NASA if they have a spare computer ---{Difficulty}--- ☑ Just press ‚A‘ ☐ Easy ☐ Significant brain usage ☐ Easy to learn / Hard to master ☐ Difficult ☐ Dark Souls ---{Grind}--- ☑ Nothing to grind ☐ Only if you care about leaderboards/ranks ☐ Isn't necessary to progress ☐ Average grind level ☐ Too much grind ☐ You‘ll need a second life for grinding ---{Game Time}--- ☐ Long enough for a cup of coffee ☐ Short ☐ Average ☐ Long ☑ To infinity and beyond ---{Price}--- ☐ It’s free! ☐ Worth the price ☐ If u have some spare money left ☑ Wait for that SALE drop ☐ Not recommended ☐ You could also just burn your money ---{Bugs}--- ☐ Never heard of ☐ Minor bugs ☑ Can get annoying ☐ ARK: Survival Evolved ☐ The game itself is a big terrarium for bugs ☐ Fallout 76 ---{Overall}--- ☐ Its so bad 😢 ☐ Ehh 🥱 ☑ Oh yeh 🙂 ☐ Not too shabby 😎 ☐ Yes baby Jesus 🥳,4,0,1,"December 29, 2021"
Mojohosavich,Mojohosavich,This game is a joke. Please let it be so that if Maxis making Sims 5 online with cross play. May it be open world as Sims 3 was and very trait emotional like sims 2 was.,49,0,-1,"June 20, 2020"
76561198083499583,RyleahMarie,"it is a good game, but it gets boring without dlcs and/or mods.",4,0,1,"November 20, 2022"
76561198056514578,Matthew,Love this game over 2000 hours on Origin while not perfect or as good as The Sims 3. I struggle to return to the older titles because CAS and Build Mode. It is so much better in this game. Also not to have a game lag to a crawl is good but they need to work out a way to open neighbourhoods so you don't hit a load screen when visiting neighbours or returning home from that neighbour etc. What they really need to work on though is the depth of the game play as everything is so easy and there are not really any consequence to the actions you do for example you could have a sim cheat on there husband/wife and to start with the sim involved is not happy but its pretty much a few sims days later and all is normal. Pros Performance is great CAS is great Build Mode my personal favourite part Graphics look good for this sort of game Some good DLC Cons Lack of depth (BIGGEST PROBLEM) Too Easy Expensive (Its like an investment if you buy all DLC) Too many load screens Trait systems suck,8,2,1,"June 23, 2020"
jaybounty,Neurion,"Product received for free I've played the sims since I was a kid (I'm now 30 as of this review). I've played every single one of them as they were released and I've enjoyed them all (Except for a couple of the spin offs), but I just cannot enjoy Sims 4 at all. A few of the features are a good addition sure, like moods, sexual orientation, customization etc. But overall, it feels like a massive downgrade over the previous Sims games. I mean, if you wanna play the Sims but have no money then sure this is a good game to just play for free. But if you have some money to drop on a Sims play through, then I'd strongly recommend going with Sims 3 + some of the expansions instead. Sims 4 took away so many features from the Sims 3 that made it such an excellent game. Until Sims 5 comes out, Sims 3 will be my go to Sims game.",6,0,-1,"March 1, 2023"
drunkennate,Marty The Cabdriver,They ruined the series with this one. Buggy since it's inception and still playable if you can put up with the new teams vision of what the real world looks like in a joking manner.,5,0,-1,"November 22, 2021"
prestyplayz,Inconsistent,"The Sims 3 is better but since this game is still getting updates and is free, I'd say its fine if you ignore the DLC part I guess.",0,0,1,"January 12, 2022"
m6rip0saa,m6rip0saa,"I shouldn't even have to write a review, it's The SIMS !!!! Obviously I recommend it. It's great.",9,0,1,August 2
76561198031353221,Shrapnel,"As a long time sims player this is by far the worst of all the sims games, the base game is boring as all get out without spending a fortune on dlc's and then the dlc's are the price of a stand a lone game.I have to say ea is the most scummy of game makers. They have ruined a once great game by making it nothing more than a cash mill. Last of the sims games I buy. I refuse to spend about 400 on dlc's to make the base game worth playing. Even buying this at 4 dollars I feel ripped. I won't be buying any of the dlc's unless they put them all together for a much lower price.",4,0,-1,"April 9, 2021"
