user_id,user_name,review_text,helpful_votes,funny_votes,recommendation,date_posted
76561198064354868,Hastur the King in Yellow,"If you're buying this game on steam to avoid Origin, then you're out of luck.  Steam just adds an extra layer of DRM and requires you to download and open origin to run the game.  It's also got less features than the Sims 3 unfortunately, so really it just comes down to slightly better graphics.  I'll play it, but I can't recommend it.",10,0,-1,"June 28, 2020"
zurugamer,Zuru,Slow and repetitive game Your sim will act retarded so you need to constantly micro manage every single life choice (even something as simple as using the toilet),8,0,-1,"November 26, 2022"
dorimi,Dorimi 王狼,"Origin is a problem, annoying.",11,0,-1,"December 21, 2020"
76561198022945293,Supernoob 500,"The game is so blatantly devoid of content without DLC, which costs over £1000 full price £555(gbp) at the minute. Feels like a mobile game compared to Sims 3. Seems to have some fun aspects though - CAS and Build modes are much better and more varied, if with slightly less customisation. I can't recommend the game due to lack of content and simply because my preference is Sims 3. You might enjoy it if you're less focused on the actual gameplay and want to build/create sims. It's also nice to have some quality of life updates that aren't in sims 3, like scaled UI and generally the game feels cleaner. But, like I said, it's obvious even from the get-go that there is hardly any content. I'd recommend Sims 3, even without mods or custom content.",8,0,-1,"October 20, 2022"
mightylink,Mightylink,"This is still not as good as The Sims 3, it's lacking so many features like the open world and create a style. I did a literal face palm when I saw the price of all the dlc's on the steam store, over $1400 to get a lot of things that used to be much cheaper in previous games. They split older expansions up into new more expensive expansions like Supernatural, it's now 4 different expansions which costs $135 to get the same amount of content as before. The neighborhoods are much smaller, with only 4 or 5 lots per map, it feels like a huge downgrade all the way back to The Sims 1 again. I honestly can't recommend this game for this price, there is no good way to buy this game, not even the Deluxe edition comes bundled with any dlc's. It would of been nice to get a more complete package for $60 especially 8 years later... The only positive thing I can say about it is that it's nice all the custom content is in game now, much like the browser from Spore, it's great to be able to just plop down a custom sim or lot without having to download and copy over files. But it doesn't add much to the game with everything that got taken away.",9,0,-1,"October 18, 2022"
76561198834790798,DovahKing Qc,paid game full price...has as much content as a 20$ game from 2010 all major updates and medium sized updates are paid dlc's because it's published by EA and no one else does that now that the game will soon be free to download...everyone will have the chance to experience the pay to enjoy meta EA seem to be enjoying to force uppon their playerbase so far GET READY TO SPEND THIS MUCH TO HAVE A DECENT UPGRADE OVER THE BASE GAME cats and dogs dlc 55$CAD ( add animals to the game ) seasons 55$CAD ( actual weather system ) at work 55$CAD ( more work options ) City living 55$CAD ( so you have a city that's not a village ) living together 55$CAD ( friends and party activities ) dineout 30$CAD ( only add restaurents ) just these few dlc's as my recomendation is literally 305$CAD before taxes just to have a decent gameplay and options to last you 30-100 hours of playtime before you can't see what's left to be done in the game you can go on Nexusmods.com and get mods to enhance your gameplay...there's also other mods on dodgier websites if you want to make your own researches but i highly recomend anyone to pick their mods on Nexusmods.com since it's safe and there's a lot of options and is begginer friendly,9,0,-1,"September 15, 2022"
76561199013185251,Waterboi,free game + $1200 in dlc,19,3,-1,"February 25, 2023"
76561198958081327,Demodestroier,"the game is fun but for a game with ""infinate replayibilety"" when i got boared and found out how expensive the dlc is i ♥♥♥♥ myself",7,5,-1,"August 15, 2020"
76561199590326337,27ehggs,escape being an adult and having responsibilities with being an adult and having responsibilities but in a video game 9/10 would recommend if you're planning on spending your inheritance on dlc,8,8,1,August 24
76561197984050627,TheGreatMango,"The game went free to play. That's cool. But it deleted all my saves, got rid of all my Sims, and has over $1000 of DLC and the only compensation Sims 4 owners were offered were a month window to claim a free $5 DLC. That's absurd. Play this game if you want, it's free - do not buy the DLC.",12,0,-1,"March 30, 2023"
76561199264843089,babyydollღ,"What can i say, this game is AMAZING. I know it says i'm only 5 hours in or so but that is because my main account is on my Xbox. I'm a new PC player but I just HAD to have this game on PC as well. There isn't a lot that I can say is negative about this game, only that i'm used to controller so working out the keys was annoying but that's it :) Definitively worth the buy! The expansion packs are really good and there are a lot to choose from so go crazy!",30,5,1,"June 3, 2022"
GaThs,GaTh,Dont buy the DLC!,9,0,-1,September 19
nvll1,emefinK,I payed $60 for this game and then I found out they made it FREE?? wtf??,8,0,-1,"September 18, 2023"
76561199389545439,ཐིཋྀ,if you dont have DLCS its boring.,12,0,-1,"December 22, 2023"
76561199061513537,Mrs. Meiily,"Its a very fun game to play if you wanna build houses and mess around with the sims you've created. in other words, making you're dream life come true in a game lol",13,3,1,"March 31, 2023"
finnedorb,Finnedorb,It's been fun for the first few hours but if you don't buy the DLC there's just nothing to do.,12,0,-1,"June 30, 2021"
nikulau,Nikula,really cool but it would be better if it could be played with friends :),7,0,1,"January 10, 2021"
76561198151707532,Milibu naghts,my sim keep insulting,8,2,-1,"November 6, 2022"
76561197994829918,dougfromtos,"The Sims 4 is a decent upgrade from the The Sims 3, but lacks default features from the previous title. Instead of adding onto the previous features of The Sims 3, the dev team created a generic base core of features with the intent of selling gameplay DLC. While more streamlined and easier to play, I still feel like I'm babysitting Sims instead of looking at the Big Picture. Due to DLC, I cannot recommend. However, the base game is playable in itself.",10,0,-1,"November 1, 2021"
76561198213169633,SpicyBeans,"Thanks to EA games for thinking we're stupid enough to buy stuff packs at 30% instead of 25% off. It's still WAY TOO MUCH and you've already raised the prices of your products just so you can put them on sale occasionally, and make it look like we're getting a better deal. Notice that only the expansions ever go on sale for 50% off? So now they'll give us an extra 5% off on the stuff packs and a pat on the head?  I'll hold my breath and wait until the whole franchise goes to 75% off before I buy any more from this very greedy company.",11,2,-1,"December 23, 2021"
76561197980755902,void,"I love the game and have played it considerably longer than thankfully Steam has listed here. That being said, unmodded the game is not worth playing. I have over 70 bug fixes installed that address stuff that isn't working correctly and overhaul mechanics that make no sense. You can't even have your Sims cook a meal and eat it together without a mod. You don't want them to drink 600 glasses of water a day? You'll need a mod to fix it.  Don't want them to die of boredom, laughter, or other weird stuff? MCCC fixes it. You want them to walk like normal people? You need another mod. Of course, with every expansion you add, the list of mods required to make the game playable grows longer. If you decide to buy it anyway, do yourself a favour and download MCCC right away. Then head over to LittleMsSam's site and download her numerous gameplay fixes and for realistic gameplay check Zero's stuff.",12,0,-1,"August 28, 2022"
Queen_Rita,Rita The Queen Of Arty,I like,11,4,1,"November 26, 2020"
thepinkjedi,☆GodBlessAmerica☆,Sims never gets old. I've been playing it for years.,6,9,1,"November 26, 2020"
76561199048528014,Chr3christian,I would not recommend this game to anyone as the base game is 40 bucks but with dlc its OVER 400$. This is a horrible way to make a game and only shows EA's greed. Instead of this game having good FREE updates the dev's add dlc after dlc until the game is behind a wall of DLC. DO NOT BUY UNLESS READY TO SHELL OUT 400$+,11,2,-1,"April 12, 2022"
LupinAi,LupinAi,"I've been a long time Sims fan, I remember playing one of them on my DS as a kid and begging to buy Sims 3 pets. Straight up, Sims 3 was way better than this. If you're going to buy Sims, get Sims 3 and don't waste all your money on this. I can't remember all the negatives about this game so I'll have to come back to update this review at some point. Pros: - The newest version of Sims and is getting updates and new content released - Sims are more emotive(?) - More customisation with a Sims body with a click and drag style. - Better graphics/smoother. This may be due to the lack of open world/free-roaming but that's also a con. - Mermaids look better in the 'Island living' DLC Cons: - Too many DLCs, most are quick cash grabs. They're expensive and useless, adding little to nothing to the base game. I can bet that a good chunk of comments one any new DLC release post is just people booing and mouthing off at the developers. You can't control yours pets in the pets DLC, there's no horses there either (I miss unicorns). The Supernatural DLCs (yes there's more than one if you want the full Sims 4 supernatural experience) has significantly less content than the one from Sims 3. Why are there around three DLCs for life stages (child, teen and young adult) ? I feel that a lot of DLCs could have been combined or been worked on more. It all feels half done. - Less personality traits. It's so bare. - No open world/free-roaming, travelling between lots is annoying. This means no cars and bikes too. - Custom colours/colour wheel and textures were removed in create a sim. - Mods are required just to make the game better (thank the community for that) - Whims are a little messed up. You can't 'cancel' them, only pin. I know I compare Sims 4 to Sims 3 a lot but it's really telling when the previous game was better than the current one. Sims 5 better exceed the lower expectations that the community have.",11,0,-1,"February 9, 2023"
76561199012813848,dovahkiin1652,"I want to start this by saying I grew up with both of these games (at around the same time), so they hold the same sentimental value to me and I am not trying to be biased, rather proving how much different EA has become when caring about their games and using more paywalls. I started by playing the Sims 3 as I couldn’t find the Sims 4 on Steam (I was young, and was willing to take any sort of Sims game as I was excited to play). After playing it for many hours, I bought the Sims 4. For both of them, I bought a few packs (with the game): Sims 3: seasons, generations, pets. | Sims 4: cats and dogs, parenthood, seasons Playing the Sims 3 with three packs was enough for hundreds of hours of content. Buying the supernatural pack had just as much content as one of the other packs and was much more than sufficient to play many games. Playing the Sims 4, however, felt much different. Playing the Sims 4 with three packs (which were worth the game at the time) felt like a whole bunch of nothing. It was missing the fun, the goofiness, and the soul that the Sims 3 had. The Sims 3 had much more, even when it came down to small gameplay mechanics. Cars, grocery shopping, visible schools and other public places, functional and lively parks, enjoyable holidays, lively cities, traits that implemented interesting gameplay mechanics, interesting moodlets, imaginary friends, backyard entertainment (such as treehouses), and much much more that I don’t think I have enough characters to write down. For the Sims 4, much of that needs mods or other game packs, and both options don’t even work half of the time. Even the Sims 3’s soundtrack sounds much more lively, leaving room for the player to think about how and what part of the game they want to discover and enjoy. I’m not saying the Sims 4’s soundtrack isn’t good, as I feel Ilan Eshkeri captured some of the franchise’s essence, however, it still feels much more like a paywall or just a huge loading screen rather than music for a game such as the Sims. It isn’t as lively, and not all of the DLC music fits together. Like Vampires - I understand it is supposed to be seen as creepy, but the gameplay should be focusing more on that aspect, not the music. The Sims 3 Supernatural didn’t add more ‘creepy’ music, instead, it found that vibe in the gameplay. The scariest thing about the Sims 4 Vampires Pack is the music and terrible clothing/hair/facial customizable options for your sims, whilst Supernatural delves deeper into the gameplay and feels more fleshed out. While it didn’t bring as much creepy music, it did bring us the song Consuming Time which is just as good, and fits the vibe for the whole game itself. The music for the DLCs in the Sims 4 feels much more pack-based, rather than focusing on the whole game’s vibe itself, making the vibe of the whole game all over the place, and scrambled. It had more use when it came to knowing the phases of the moon, researching vampires, PLAYING as vampires, or any of the other options that the DLC added (witches, wizards, werewolves, fairies). Each was unique, having much more interesting interactions than Vampires, Werewolves, and Realm of Magic combined. That is another thing I want to add is the fact that the Sims 4 has so many separated packs, when the Sims 3 had Werewolves, Realm of Magic, and Vampires combined, and did not cost as much as the game. The same thing goes for the Sims 3 Pets versus the Sims 4 Dogs and Cats, My First Pet Stuff, and Horse Ranch. Sims 3 Pets has all those options all in one DLC, less than the game, and actually works and has sufficient content (all three of those are missing one or the other, Dogs and Cats and My First Pet Stuff being boring/a whole lot of nothing while Horse Ranch is literally just broken). The fact that many of the packs can still cost up to 50 dollars for broken, separated gameplay with only one of the advertised products in the game is so disappointing. I understand the Sims 3 used to be 40 dollars, but it also has so much more to offer compared to the Sims 4, even in base-game. It’s actually playable by itself. Although the Sims 4 is now free, I still wouldn’t recommend it to any first-time players. Yes, the Sims 3 is older and can have some problems (such as glitching when you try to open it, having sensitivity problems), but it still is a much better starting place than the Sims 4. The only people who would want to play the Sims 4 either don’t know how boring the game is unless you buy hundreds of dollars worth of DLCs or are seasoned players hoping that someday this game will be good. I have spent well over 500 dollars into this game and it still isn’t playable. Playing thousands of hours of the Sims 3 and then finally saving up enough to buy this one was such a disappointment. The DLCs for the Sims used to add so much and certainly weren’t the same as the game itself. EA has done this sort of thing recently, whether it be with the Sims, Fortnite, Madden, FIFA, etc (in which I have had experience with all games listed) have had some sort of microtransactions. The games often feel incomplete (or versions of the game, in cases such as Fortnite) and are either missing the ‘pizzazz’ so to speak of the last game or have become unenjoyable. For a seven-year-old game, you would expect the DLCs to be enjoyable, and actually add stuff to the game, and work half the time. But even the newest releases have problems, such as; Party Essentials Kit, For Rent, Wedding Stories, Dream Home Decorater, Backyard Stuff, Vintage Glamour, Bowling Night, ect ect (some of those aren’t new, but you get my point, only half of them work, and most of them add like two items to the game). I understand most of the packs listed are only around 5 dollars, but why even make them that much? Why can’t you just add them to the game to begin with, making it a little bit more enjoyable and worth anything? It has been very hard for me to get even an hour out of this game at a time, and trying to squeeze out as much content as this game offers has proven difficult and frustrating. I had to actively work to find stuff to do in this version, completely unlike the Sims 3. Even the pre-set households in the Sims 3 felt more interesting than anything in the Sims 4. I tried building cities, families, and storylines in the Sims 4 and it just felt so forced. That is yet another problem with EA and the Sims franchise recently; EA only cares about the money they receive from this game, and does not care about the quality of the products they are selling for it. All the DLCs for this game add up to over 1,000 dollars. Half of them don’t work. It is upsetting to see a game franchise devolve in quality and have the creators only care about the profit. If EA actually cared for this game, listened to even half of the critics, and fixed these problems it would make them so much more money. Who knew - that making an enjoyable game would appease players? Hopefully (yet unlikely), EA will turn this game around and make it more enjoyable like its predecessors, or make the next game in this series an improvement to the dumpster fire we have now. All in all, the Sims 3 (or even Sims 2, for that matter) is much more enjoyable, and I would consider spending my money on that game before spending any sort of time playing this one. It is so much more fleshed out and detailed in so many more ways and is overall just a better game. For a franchise so meaningful to people, with a record of being enjoyable for years on end from each installment, I am extremely disappointed in how this game has turned out.",12,0,-1,June 26
76561198980755744,HyperCatty,"You made it free to play- AFTER MAKING OTHER PEOPLE PAY LIKE WHAT- $30 OR MORE DOLLARS????? then make a lot of DLCs to make up the money that you won't get- the DLCs that are the ONLY things that make the game actually good???? GEE THANKS- I wish I got a money refund before spending so many hours on this, truly I do. because I know for a fact that A LOT of people will agree on this- a lot.",8,0,-1,"November 21, 2022"
KZstu,KZstu,"The game is really good, It's just that it has been ""EA'd"" It's $600 NZD for the full game and is an empty husk without the DLCs. I almost gave this a positive review because Maxis did a good job on the game yet you have to essentially pay full game price to add pets...",9,0,-1,"December 30, 2020"
whodafuckwantstoknow,SoulReaper115,"after an update, the origin app no longer exists. you must use EA's invasive app in order to play the sims. despite turning off  'open on startup', which is on by default, it still popped up and tried to force me into the EA app before I had a chance to do anything else on the computer. I will be uninstalling and not reinstalling. I bough this game and a fair amount of dlc. I enjoy it, but I would rather never play it again than have to deal with the EA app.",12,0,-1,"February 10, 2023"
76561199206986134,cloutierjn,"Actually insane how all DLCs are 800 dollars. I get it paying game devs but this isnt a small or indie game and you have to buy all packs individually for 10-40 dollars. You can buy an actually COMPLETE game for that much. Its insane, and a clear cash grab since base game is bland without anything added. I would like the game more if I didnt also find it absolutely atrocious on EA's end.",8,0,-1,February 12
76561198201520231,Ribalder,"Product refunded thumbs down, u have to also have AND SIGN INTO an Origin account. ??? and game looks plays really bad, i played 23 minutes an refunded. back to 3. not for 4.99., not even for free.",17,6,-1,"November 4, 2020"
AOGSTUDIO,AOG,I just love building a lot of things!,14,3,1,"November 3, 2023"
cyberprincevp,overlord苦味,economically disadvantageous game :(,8,0,-1,"October 7, 2020"
76561199045747177,lori,fenomenal,9,6,1,"March 28, 2022"
76561199120702449,Mystery_smudge,cicken bock bock,21,12,1,"April 15, 2022"
niraja,Niraja,"I have played SIMS 3, and SIMS 4 is supposed to be better, right? But to me it seems the other way around. Also it needs you to pay crazy amounts for lame-ass DLCs.",9,0,-1,"April 25, 2021"
76561198995396734,mazarinhanna,angry bc i spent money on this and now its free :rage:,11,6,1,"October 18, 2022"
76561198081248051,yeyeyessy,"i having fun playing the sims since i was 12 years old. Recomended for high resolution. The Sims 4 just offers me something different. But, i think the sims 3 much better, because more simple then the sims 4.",10,3,1,"February 17, 2021"
ViperTech0911,ViperTech0911,"As much as I would love to recommend the Sims because its a game of nostalgia for me, I can't because of the micro-transactions.  How do you charge for a ""clutter"" pack or add-ons for a game you pay full price for.  If it was a free game with additional items you could buy, OK, but its not.  It just shows EA's predatory nature they have become.",15,0,-1,April 12
76561198031477106,Composted,"I bought this game because I though it would be an upgrade to Sims 3. It's not. It's a downgrade and a half. In sims three, you had a whole town or city to play around in, destintation resorts with fairly sized maps, however in Sims 4 you get half a block to play in. 10 plots max on a map, including stores, building lots, and a lot of boredom. I did purchase the base game and a bunch of DLC, but even the DLC didn't really add anything worthwhile to the game. I recommend skipping this version and wait for Sims 5... or just stick with Sims 3.",14,0,-1,"November 16, 2020"
brayson290,Brayson290,"Honestly I enjoy this game, it says I have 400 hours on record but on origin I have over 4000. However, I can't play it without a lot of gameplay mods. Also as the developers add more and more dlc, the more broken the game is, and they rarely go back and fix major issues with older packs, they just want that next paycheck. As of writing this review, the new high school expansion came out and the patch that came out two days before broke the game to the point where a lot of people don't feel comfortable even opening their game right now, and we don't even have an eta when a fix is coming. I can't recommend this game until a lot of things are fixed.",10,0,-1,"July 29, 2022"
76561198079475382,Hansen B. Uppercrust the 3rd,The Sims have overdone their formula only to be masked in 300 dollars worth of DLC. It is just so lame to mindlessly drone chores for one sim after another... EA bent this one over the counter.,15,3,-1,"October 27, 2020"
76561199022253487,DeezNutsGaming,"As you can see Mojahed disagrees with my amazing review, flame his ass.",10,0,-1,"October 20, 2022"
tehmez,tehmez,"stop typing ""dude wtf"" on steam. my sister is playing, not me",16,26,1,"July 9, 2023"
76561198446444296,Admin425,"Although it is a VERY fun game, there is for some reason over $1,000 worth of DLC on the store with no Season Pass? That is very ridiculous for any game.",16,0,-1,"August 2, 2023"
rdz_nathan,พยาธิในรูขี้,Fix your ♥♥♥♥♥♥♥ broken game before releasing more expansion packs.,9,0,-1,August 15
76561199217470085,Cat Is D,"The base game with no dlc get boring easily (Without mods) I spent 15 dollars on an overpriced mid dlc (I got it half off) and now my game is laggy, everything is delayed and my sims a.i is completely busted with them standing in on place for hours and refusing to do what I tell them to (Go to bed, cook, clean. etc) I feel that I wasted my 15 dollars Update: fixed the issue, game still sucks tho :/",13,0,-1,"December 27, 2023"
